full_name,mirror_url,archived,disabled,if_fork,size,files,stars,watches,forks,recent_commits,recent_added,recent_deleted,recent_contributors,latest_commits,owner_type,description,formats,homepage,license,language,commits,branches,releases,contributors,topics,age,has_issues,open_issues,closed_issues,open_issues_recent,closed_issues_recent,open_prs,closed_prs,open_prs_recent,closed_prs_recent,labels,milestones,dependent_repositories,dependent_packages,repositories,people,followers,readme,info
bookshelf/bookshelf,,False,False,False,7240,102,5922,101,533,26,1883,782,8,"[34, 76, 88, 105, 111, 120, 127, 131, 134, 135]",Organization,"A simple Node.js ORM for PostgreSQL, MySQL and SQLite3 built on top of Knex.js","{'json': 5, 'md': 14, '': 7, 'yml': 4, 'js': 45, 'html': 21, 'svg': 1, 'ico': 1, 'txt': 1, 'css': 1, 'sh': 2}",http://bookshelfjs.org,"{'key': 'mit', 'name': 'MIT License', 'spdx_id': 'MIT', 'url': 'https://api.github.com/licenses/mit', 'node_id': 'MDc6TGljZW5zZTEz'}",JavaScript,1894,7,85,85,8,2676,True,203,1326,8,14,0,551,0,12,32,0,17621,404,11,5,,"# bookshelf.jsþþ[![NPM Version](https://img.shields.io/npm/v/bookshelf.svg?style=flat)](https://www.npmjs.com/package/bookshelf)þ[![Build Status](https://api.travis-ci.org/bookshelf/bookshelf.svg?branch=master)](https://travis-ci.org/bookshelf/bookshelf)þ[![Dependency Status](https://david-dm.org/bookshelf/bookshelf/status.svg)](https://david-dm.org/bookshelf/bookshelf)þ[![devDependency Status](https://david-dm.org/bookshelf/bookshelf/dev-status.svg)](https://david-dm.org/bookshelf/bookshelf?type=dev)þþBookshelf is a JavaScript ORM for Node.js, built on the [Knex](http://knexjs.org) SQL query builder. It features both Promise-based and traditional callback interfaces, transaction support, eager/nested-eager relation loading, polymorphic associations, and support for one-to-one, one-to-many, and many-to-many relations.þþIt is designed to work with PostgreSQL, MySQL, and SQLite3.þþ[Website and documentation](http://bookshelfjs.org). The project is [hosted on GitHub](http://github.com/bookshelf/bookshelf/), and has a comprehensive [test suite](https://travis-ci.org/bookshelf/bookshelf).þþ## IntroductionþþBookshelf aims to provide a simple library for common tasks when querying databases in JavaScript, and forming relations between these objects, taking a lot of ideas from the [Data Mapper Pattern](http://en.wikipedia.org/wiki/Data_mapper_pattern).þþWith a concise, literate codebase, Bookshelf is simple to read, understand, and extend. It doesn't force you to use any specific validation scheme, and provides flexible, efficient relation/nested-relation loading and first-class transaction support.þþIt's a lean object-relational mapper, allowing you to drop down to the raw Knex interface whenever you need a custom query that doesn't quite fit with the stock conventions.þþ## InstallationþþYou'll need to install a copy of [Knex](http://knexjs.org/), and either `mysql`, `pg`, or `sqlite3` from npm.þþ```jsþ$ npm install knexþ$ npm install bookshelfþþ# Then add one of the following:þ$ npm install pgþ$ npm install mysqlþ$ npm install sqlite3þ```þþThe Bookshelf library is initialized by passing an initialized [Knex](http://knexjs.org/) client instance. The [Knex documentation](http://knexjs.org/) provides a number of examples for different databases.þþ```jsþ// Setting up the database connectionþconst knex = require('knex')({þ  client: 'mysql',þ  connection: {þ    host     : '127.0.0.1',þ    user     : 'your_database_user',þ    password : 'your_database_password',þ    database : 'myapp_test',þ    charset  : 'utf8'þ  }þ})þconst bookshelf = require('bookshelf')(knex)þþ// Defining modelsþconst User = bookshelf.model('User', {þ  tableName: 'users'þ})þ```þþThis initialization should likely only ever happen once in your application. As it creates a connection pool for the current database, you should use the `bookshelf` instance returned throughout your library. You'll need to store this instance created by the initialize somewhere in the application so you can reference it. A common pattern to follow is to initialize the client in a module so you can easily reference it later:þþ```jsþ// In a file named, e.g. bookshelf.jsþconst knex = require('knex')(dbConfig)þmodule.exports = require('bookshelf')(knex)þþ// elsewhere, to use the bookshelf client:þconst bookshelf = require('./bookshelf')þþconst Post = bookshelf.model('Post', {þ  // ...þ})þ```þþ## ExamplesþþHere is an example to get you started:þþ```jsþconst knex = require('knex')({þ  client: 'mysql',þ  connection: process.env.MYSQL_DATABASE_CONNECTIONþ})þconst bookshelf = require('bookshelf')(knex)þþconst User = bookshelf.model('User', {þ  tableName: 'users',þ  posts() {þ    return this.hasMany(Posts)þ  }þ})þþconst Post = bookshelf.model('Post', {þ  tableName: 'posts',þ  tags() {þ    return this.belongsToMany(Tag)þ  }þ})þþconst Tag = bookshelf.model('Tag', {þ  tableName: 'tags'þ})þþnew User({id: 1}).fetch({withRelated: ['posts.tags']}).then((user) => {þ  console.log(user.related('posts').toJSON())þ}).catch((error) => {þ  console.error(error)þ})þ```þþ## Official Pluginsþþ* [Virtuals](https://github.com/bookshelf/virtuals-plugin): Define virtual properties on your model to compute new values.þ* [Case Converter](https://github.com/bookshelf/case-converter-plugin): Handles the conversion between the database's snake_cased and a model's camelCased properties automatically.þ* [Processor](https://github.com/bookshelf/processor-plugin): Allows defining custom processor functions that handle transformation of values whenever they are `.set()` on a model.þþ## Community pluginsþþ* [bookshelf-cascade-delete](https://github.com/seegno/bookshelf-cascade-delete) - Cascade delete related models on destroy.þ* [bookshelf-json-columns](https://github.com/seegno/bookshelf-json-columns) - Parse and stringify JSON columns on save and fetch instead of manually define hooks for each model (PostgreSQL and SQLite).þ* [bookshelf-mask](https://github.com/seegno/bookshelf-mask) - Similar to the functionality of the {@link Model#visible} attribute but supporting multiple scopes, masking models and collections using the [json-mask](https://github.com/nemtsov/json-mask) API.þ* [bookshelf-schema](https://github.com/bogus34/bookshelf-schema) - A plugin for handling fields, relations, scopes and more.þ* [bookshelf-signals](https://github.com/bogus34/bookshelf-signals) - A plugin that translates Bookshelf events to a central hub.þ* [bookshelf-paranoia](https://github.com/estate/bookshelf-paranoia) - Protect your database from data loss by soft deleting your rows.þ* [bookshelf-uuid](https://github.com/estate/bookshelf-uuid) - Automatically generates UUIDs for your models.þ* [bookshelf-modelbase](https://github.com/bsiddiqui/bookshelf-modelbase) - An alternative to extend `Model`, adding timestamps, attribute validation and some native CRUD methods.þ* [bookshelf-advanced-serialization](https://github.com/sequiturs/bookshelf-advanced-serialization) - A more powerful visibility plugin, supporting serializing models and collections according to access permissions, application context, and after ensuring relations have been loaded.þ* [bookshelf-plugin-mode](https://github.com/popodidi/bookshelf-plugin-mode) - Plugin inspired by the functionality of the {@link Model#visible} attribute, allowing to specify different modes with corresponding visible/hidden fields of model.þ* [bookshelf-secure-password](https://github.com/venables/bookshelf-secure-password) - A plugin for easily securing passwords using bcrypt.þ* [bookshelf-default-select](https://github.com/DJAndries/bookshelf-default-select) - Enables default column selection for models. Inspired by the functionality of the {@link Model#visible} attribute, but operates on the database level.þ* [bookshelf-ez-fetch](https://github.com/DJAndries/bookshelf-ez-fetch) - Convenient fetching methods which allow for compact filtering, relation selection and error handling.þ* [bookshelf-manager](https://github.com/ericclemmons/bookshelf-manager) - Model & Collection manager to make it easy to create & save deep, nested JSON structures from API requests.þþ## SupportþþHave questions about the library? Come join us in the [#bookshelf freenode IRC channel](http://webchat.freenode.net/?channels=bookshelf) for support on [knex.js](http://knexjs.org/) and bookshelf.js, or post an issue on [Stack Overflow](http://stackoverflow.com/questions/tagged/bookshelf.js).þþ## ContributingþþIf you want to contribute to Bookshelf you'll usually want to report an issue or submit aþpull-request. For this purpose the [online repository](https://github.com/bookshelf/bookshelf/) isþavailable on GitHub.þþFor further help setting up your local development environment or learning how you can contribute toþBookshelf you should read the [Contributing document](https://github.com/bookshelf/bookshelf/blob/master/.github/CONTRIBUTING.md)þavailable on GitHub.þþ## F.A.Q.þþ### Can I use standard node.js style callbacks?þþYes, you can call `.asCallback(function(err, resp) {` on any database operation method and use the standard `(err, result)` style callback interface if you prefer.þþ### My relations don't seem to be loading, what's up?þþMake sure to check that the type is correct for the initial parameters passed to the initial model being fetched. For example `new Model({id: '1'}).load([relations...])` will not return the same as `new Model({id: 1}).load([relations...])` - notice that the id is a string in one case and a number in the other. This can be a common mistake if retrieving the id from a url parameter.þþThis is only an issue if you're eager loading data with load without first fetching the original model. `new Model({id: '1'}).fetch({withRelated: [relations...]})` should work just fine.þþ### My process won't exit after my script is finished, why?þþThe issue here is that Knex, the database abstraction layer used by Bookshelf, uses connection pooling and thus keeps the database connection open. If you want your process to exit after your script has finished, you will have to call `.destroy(cb)` on the `knex` property of your `Bookshelf` instance or on the `Knex` instance passed during initialization. More information about connection pooling can be found over at the [Knex docs](http://knexjs.org/#Installation-pooling).þþ### How do I debug?þþIf you pass `debug: true` in the options object to your `knex` initialize call, you can see all of the query calls being made. You can also pass that same option to all methods that access the database, like `model.fetch()` or `model.destroy()`. Examples:þþ```jsþ// Turning on debug mode for all queriesþconst knex = require('knex')({þ  debug: true,þ  client: 'mysql',þ  connection: process.env.MYSQL_DATABASE_CONNECTIONþ})þconst bookshelf = require('bookshelf')(knex)þþ// Debugging a single queryþnew User({id: 1}).fetch({debug: true, withRelated: ['posts.tags']}).then(user => {þ  // ...þ})þ```þþSometimes you need to dive a bit further into the various calls and see what all is going on behind the scenes. You can use [node-inspector](https://github.com/dannycoates/node-inspector), which allows you to debug code with `debugger` statements like you would in the browser.þþBookshelf uses its own copy of the `bluebird` Promise library. You can read up [here](http://bluebirdjs.com/docs/api/promise.config.html) for more on debugging Promises.þþAdding the following block at the start of your application code will catch any errors not otherwise caught in the normal Promise chain handlers, which is very helpful in debugging:þþ```jsþprocess.stderr.on('data', (data) => {þ  console.log(data)þ})þ```þþ### How do I run the test suite?þþSee the [CONTRIBUTING](https://github.com/bookshelf/bookshelf/blob/master/.github/CONTRIBUTING.md#running-the-tests)þdocument on GitHub.þþ### Can I use Bookshelf outside of Node.js?þþWhile it primarily targets Node.js, all dependencies are browser compatible, and it could be adapted to work with other javascript environments supporting a sqlite3 database, by providing a custom [Knex adapter](http://knexjs.org/#Adapters). No such adapter exists though.þþ### Which open-source projects are using Bookshelf?þþWe found the following projects using Bookshelf, but there can be more:þþ* [Ghost](https://ghost.org/) (A blogging platform) uses bookshelf. [[Link](https://github.com/TryGhost/Ghost/tree/master/core/server/models)]þ* [Soapee](http://soapee.com/) (Soap Making Community and Resources) uses bookshelf. [[Link](https://github.com/nazar/soapee-api/tree/master/src/models)]þ* [NodeZA](http://nodeza.co.za/) (Node.js social platform for developers in South Africa) uses bookshelf. [[Link](https://github.com/qawemlilo/nodeza/tree/master/models)]þ* [Sunday Cook](https://github.com/sunday-cooks/sunday-cook) (A social cooking event platform) uses bookshelf. [[Link](https://github.com/sunday-cooks/sunday-cook/tree/master/server/bookshelf)]þ* [FlyptoX](http://www.flyptox.com/) (Open-source Node.js cryptocurrency exchange) uses bookshelf. [[Link](https://github.com/FlipSideHR/FlyptoX/tree/master/server/models)]þ* And of course, everything on [here](https://www.npmjs.com/browse/depended/bookshelf) use bookshelf too.",
Darkhax-Minecraft/Bookshelf,,False,False,False,2384,83,38,8,18,112,5277,5875,2,"[0, 1, 2, 47, 51, 53, 58, 63, 69, 71]",Organization,A library mod which adds additional code support beyond what is provided by Forge.,"{'': 3, 'md': 2, 'gradle': 1, 'properties': 2, 'jar': 1, 'bat': 1, 'java': 58, 'cfg': 1, 'toml': 1, 'json': 11, 'png': 1, 'mcmeta': 1}",,"{'key': 'lgpl-2.1', 'name': 'GNU Lesser General Public License v2.1', 'spdx_id': 'LGPL-2.1', 'url': 'https://api.github.com/licenses/lgpl-2.1', 'node_id': 'MDc6TGljZW5zZTEx'}",Java,1244,10,0,21,0,1840,True,0,92,0,10,0,51,0,2,7,0,0,0,90,1,,,
