full_name,mirror_url,archived,disabled,if_fork,size,files,stars,watches,forks,recent_commits,recent_added,recent_deleted,recent_contributors,latest_commits,owner_type,description,formats,homepage,license,language,commits,branches,releases,contributors,topics,age,has_issues,open_issues,closed_issues,open_issues_recent,closed_issues_recent,open_prs,closed_prs,open_prs_recent,closed_prs_recent,labels,milestones,dependent_repositories,dependent_packages,repositories,people,followers,readme,info
federicoiosue/Omni-Notes,,False,False,False,42790,924,2101,156,943,18,1639,1453,2,"[36, 111, 116, 117, 153, 173, 175, 176, 180, 181]",User,Open source note-taking application for Android,"{'': 3, 'yml': 1, 'md': 3, 'txt': 11, 'xcf': 2, 'png': 462, 'scss': 1, 'svg': 4, 'xml': 215, 'gradle': 3, 'properties': 4, 'jar': 1, 'bat': 1, 'java': 196, 'ttf': 3, 'html': 1, 'sql': 12, 'jpg': 1}",https://omninotes.app,"{'key': 'gpl-3.0', 'name': 'GNU General Public License v3.0', 'spdx_id': 'GPL-3.0', 'url': 'https://api.github.com/licenses/gpl-3.0', 'node_id': 'MDc6TGljZW5zZTk='}",Java,3006,18,127,127,13,2448,True,164,481,21,5,16,77,3,1,23,3,0,0,,,224," ![icon](assets/logo.png)þþOmni-Notesþ==========þþ![SLicense](https://img.shields.io/badge/License-GPLv3-red.svg)þ[![Crowdin](https://d322cqt584bo4o.cloudfront.net/omni-notes/localized.png)](https://crowdin.com/project/omni-notes)þ[![Build Status](https://travis-ci.org/federicoiosue/Omni-Notes.svg?branch=develop)](https://travis-ci.org/federicoiosue/Omni-Notes)þ[![Codacy Badge](https://api.codacy.com/project/badge/Grade/8ade707d00ef468fa79d3f6b622444b5)](https://www.codacy.com/app/federico-iosue/Omni-Notes?utm_source=github.com&amp;utm_medium=referral&amp;utm_content=federicoiosue/Omni-Notes&amp;utm_campaign=Badge_Grade)þ[![GitHub release](https://img.shields.io/github/release/federicoiosue/omni-notes.svg)](https://github.com/federicoiosue/Omni-Notes/releases/latest)þþNote taking <b>open-source</b> application aimed to have both a <b>simple interface</b> but keeping <b>smart</b> behavior.þþThe project was inspired by the absence of such applications compatible with old phones and old versions of Android. It aims to provide an attractive look and follow the most recent design guidelines of the Google operating system.þþ**Follow the developments and post your comments and advice on Facebook Community at https://www.facebook.com/OmniNotes**þþ*Help to keep translations updated is always welcome, if you want give a hand checkout the translation project on **https://translate.omninotes.app.** *þþ<a href=""https://f-droid.org/repository/browse/?fdid=it.feio.android.omninotes.foss"" target=""_blank"">þ<img src=""https://f-droid.org/badge/get-it-on.png"" alt=""Get it on F-Droid"" height=""90""/></a>þ<a href=""https://play.google.com/store/apps/details?id=it.feio.android.omninotes"" target=""_blank"">þ<img src=""https://play.google.com/intl/en_us/badges/images/generic/en-play-badge.png"" alt=""Get it on Google Play"" height=""90""/></a>þþ## FeaturesþþCurrently the following functions are implemented:þþ* Material Design interfaceþ  *Basic add, modify, archive, trash and delete notes actionsþ* Share, merge and search notesþ* Image, audio and generic file attachmentsþ* Manage your notes using tags and categoriesþ* To-do listþ* Sketch-note modeþ* Notes shortcut on home screenþ* Export/import notes to backupþ* Google Now integration: just tell ""write a note"" followed by the contentþ* Multiple widgets, DashClock extension, Android 4.2 lockscreen compatibilityþ* Multilanguage: 30+ languages supported: https://crowdin.com/project/omni-notesþþþFurther developments will include:þþ* Notes sychronizationþ* Web interface to manage notes ([stub project](https://github.com/federicoiosue/omni-notes-desktop))þþYou can find a complete changelog inside the application settings menu!þþIf you need some help on how to use the application you'll find everything you need in the [Help Online](assets/help/help.md) section.þþ![](https://raw.githubusercontent.com/federicoiosue/Omni-Notes/develop/assets/play_store_pics/02.png)þ![](https://raw.githubusercontent.com/federicoiosue/Omni-Notes/develop/assets/play_store_pics/03.png)þ![](https://raw.githubusercontent.com/federicoiosue/Omni-Notes/develop/assets/play_store_pics/04.png)þ![](https://raw.githubusercontent.com/federicoiosue/Omni-Notes/develop/assets/play_store_pics/05.png)þ![](https://raw.githubusercontent.com/federicoiosue/Omni-Notes/develop/assets/play_store_pics/06.png)þ![](https://raw.githubusercontent.com/federicoiosue/Omni-Notes/develop/assets/play_store_pics/07.png)þ![](https://raw.githubusercontent.com/federicoiosue/Omni-Notes/develop/assets/play_store_pics/08.png)þ![](https://raw.githubusercontent.com/federicoiosue/Omni-Notes/develop/assets/play_store_pics/09.png)þ![](https://raw.githubusercontent.com/federicoiosue/Omni-Notes/develop/assets/play_store_pics/10.png)þ![](https://raw.githubusercontent.com/federicoiosue/Omni-Notes/develop/assets/play_store_pics/11.png)þ![](https://raw.githubusercontent.com/federicoiosue/Omni-Notes/develop/assets/play_store_pics/12.png)þþ## User guideþþLook into the wiki for GIFs-based tutorials: [LINK](https://github.com/federicoiosue/Omni-Notes/wiki)þþ## BuildþþWatch the following terminal session recording on how to compile distributable filesþ[![asciicast](https://asciinema.org/a/102898.png)](https://asciinema.org/a/102898)þþ## TestþþTo execute all tests included into the project connect a device or emulator, then run the following command:þþ```shellþ./gradlew connectedAndroidTestþ```þþ## ContributingþþDue to the fact that I'm using [gitflow](https://github.com/nvie/gitflow) as code versioning methodology, you as developer should **always** start working on [develop branch](https://github.com/federicoiosue/Omni-Notes/tree/develop) that contains the most recent changes.þþThere are many features/improvements that are not on **my** roadmap but someone else could decide to work on them anyway: hunt for issues tagged as [Help Wanted](https://github.com/federicoiosue/Omni-Notes/issues?utf8=✓&q=label%3A""Help+wanted"") to find them!þþFeel free to add yourself to [contributors.md](https://github.com/federicoiosue/Omni-Notes/blob/develop/contributors.md) file.þþ### New feature or improvements contributionsþþThis kind of contributions **must** have screenshots or screencast as demonstration of the new additions.þþ### Code styleþþIf you plan to manipulate the code then you'll have to do it by following a [specific code style](https://gist.github.com/federicoiosue/dee53e882b3c70d544f8608769eb02fc).þAlso pay attention if you're using any plugin that automatically formats/cleans/rearrange your code and set it to only change that code that you touched and not the whole files.þþ### Test your code contributions!þþAll code changes and additions **must** be tested.þSee the [related section](#test) for more informations or this two pull requests comments: [one](https://github.com/federicoiosue/Omni-Notes/pull/646#pullrequestreview-187973443) and [two](https://github.com/federicoiosue/Omni-Notes/pull/683#issuecomment-506206689)þþ### Forking projectþþWhen forking the project you'll have to modify some files that are strictly dependent from my own development / build / third-party-services environment. Files that need some attention are the following:þþ  - *gradle.properties*: this is overridden by another file with the same name inside the *omniNotes* module. You can do the same or leave as it is, any missing property will let the app gracefully fallback on a default behavior.þ  - *.travis.yml*: if you use [TravisCI](https://travis-ci.org/) as continuous integration platform and a SonarQUBE instance for code quality analysis you'll have to modify this file according to your needs.þþ## Code qualityþþA public instance of SonarQube is available both to encourage other developers to improve their code contributions (and existing code obviously) and to move the project even further into transparency and openness.þþCheckout for it [here](https://sonarcloud.io/dashboard?id=omni-notes)þþPull requests will be automatically analyzed and rejected if they'll rise the code technical debt.þþ## DependenciesþþThey're all listed into the [build.gradle](https://github.com/federicoiosue/Omni-Notes/blob/develop/omniNotes/build.gradle) file but due to the fact that many of the dependences have been customized by me I'd like to say thanks here to the original developers of these great libraries:þþ* https://github.com/RobotiumTech/robotiumþ* https://github.com/flavienlaurent/datetimepickerþ* https://github.com/LarsWerkman/HoloColorPickerþ* https://github.com/keyboardsurfer/Croutonþ* https://github.com/romannurik/dashclock/wiki/APIþ* https://github.com/ACRA/acraþ* https://github.com/Shusshu/Android-RecurrencePickerþ* https://github.com/gabrielemariotti/changeloglibþ* https://github.com/greenrobot/EventBusþ* https://github.com/futuresimple/android-floating-action-buttonþ* https://github.com/keyboardsurferþ* https://github.com/nhaarman/ListViewAnimationsþ* https://github.com/bumptech/glideþ* https://github.com/neopixl/PixlUIþ* https://github.com/afollestad/material-dialogsþ* https://github.com/JakeWharton/butterknifeþ* https://github.com/ical4jþ* https://github.com/square/leakcanaryþ* https://github.com/pnikosis/materialish-progressþ* https://github.com/apl-devs/AppIntroþ* https://github.com/ReactiveX/RxAndroidþ* https://github.com/artem-zinnatullin/RxJavaProGuardRulesþ* https://github.com/tbruyelle/RxPermissionsþ* https://github.com/ocpsoft/prettytimeþ* https://github.com/piwik/piwik-sdk-androidþ* https://github.com/mrmans0n/smart-location-libþþþþ## Developed with love and passion byþþþ* Federico Iosue - [Website](https://federico.iosue.it)þ* [Other contributors](https://github.com/federicoiosue/Omni-Notes/blob/master/https://github.com/federicoiosue/Omni-Notes/blob/master/CONTRIBUTORS.md)þþþþ## Licenseþþþ    Copyright 2013-2019 Federico Iosueþ    þ    This program is free software: you can redistribute it and/or modifyþ    it under the terms of the GNU General Public License as published byþ    the Free Software Foundation, either version 3 of the License, orþ    (at your option) any later version.þ    þ    This program is distributed in the hope that it will be useful,þ    but WITHOUT ANY WARRANTY; without even the implied warranty ofþ    MERCHANTABILITY or FITNESS FOR A PARTICULAR PURPOSE.  See theþ    GNU General Public License for more details.þ    þ    You should have received a copy of the GNU General Public Licenseþ    along with this program.  If not, see <http://www.gnu.org/licenses/>.",
MiCode/Notes,,False,False,False,3490,147,1709,210,848,0,0,0,0,"[3067, 3076, 3077, 3078, 3105, 3106, 3119]",Organization,小米便签社区开源版（Community edition of XM notepad/MIUI notes),"{'': 5, 'xml': 38, 'png': 65, 'java': 39}",http://micode.net/forum-38-1.html,,Java,21,1,0,3,0,3119,True,1,1,0,0,5,14,0,0,0,0,0,0,68,0,,"[中文]þþ1. MiCode便签是小米便签的社区开源版，由MIUI团队(www.miui.com) 发起并贡献第一批代码，遵循NOTICE文件所描述的开源协议，þ   今后为MiCode社区(www.micode.net) 拥有，并由社区发布和维护。þþ2. Bug反馈和跟踪，请访问Github,þ   https://github.com/MiCode/Notes/issues?sort=created&direction=desc&state=openþþ3. 功能建议和综合讨论，请访问MiCode,þ   http://micode.net/forum.php?mod=forumdisplay&fid=38þþþ[English]þþ1. MiCode Notes is open source edition of XM notepad, it's first initiated and sponsored by MIUI team (www.miui.com).þ   It's opened under license described by NOTICE file. It's owned by the MiCode community (www.micode.net). In future,þ   the MiCode community will release and maintain this project.þþ2. Regarding issue tracking, please visit Github,þ   https://github.com/MiCode/Notes/issues?sort=created&direction=desc&state=openþþ3. Regarding feature request and general discussion, please visit Micode forum,þ   http://micode.net/forum.php?mod=forumdisplay&fid=38",
heibaiying/BigData-Notes,,False,False,False,24065,629,7255,340,2033,18,708,410,2,"[17, 18, 32, 40, 42, 47, 61, 65, 129, 173]",User,大数据入门指南  :star:,"{'': 1, 'md': 101, 'xml': 25, 'java': 69, 'properties': 6, 'txt': 3, 'scala': 8, 'yml': 1, 'png': 380, 'psd': 1, 'jpg': 24, 'xmind': 1, 'csv': 1, 'json': 2, 'jar': 1, 'orc': 1, 'parquet': 2, 'tsv': 2}",,,Java,587,1,0,2,17,489,True,0,16,0,6,0,6,0,2,8,0,0,0,,,237,"# BigData-Notesþþþþ<div align=""center""> <img width=""444px"" src=""https://gitee.com/heibaiying/BigData-Notes/raw/master/pictures/bigdata-notes-icon.png""/> </div>þ<br/>þþ**大数据入门指南**þþþþ<table>þ    <tr>þ      <th><img width=""50px"" src=""https://gitee.com/heibaiying/BigData-Notes/raw/master/pictures/hadoop.jpg""></th>þ      <th><img width=""50px"" src=""https://gitee.com/heibaiying/BigData-Notes/raw/master/pictures/hive.jpg""></th>þ      <th><img width=""50px"" src=""https://gitee.com/heibaiying/BigData-Notes/raw/master/pictures/spark.jpg""></th>þ      <th><img width=""50px"" src=""https://gitee.com/heibaiying/BigData-Notes/raw/master/pictures/storm.png""></th>þ      <th><img width=""50px"" src=""https://gitee.com/heibaiying/BigData-Notes/raw/master/pictures/flink.png""></th>þ      <th><img width=""50px"" src=""https://gitee.com/heibaiying/BigData-Notes/raw/master/pictures/hbase.png""></th>þ      <th><img width=""50px"" src=""https://gitee.com/heibaiying/BigData-Notes/raw/master/pictures/kafka.png""></th>þ      <th><img width=""50px"" src=""https://gitee.com/heibaiying/BigData-Notes/raw/master/pictures/zookeeper.jpg""></th>þ      <th><img width=""50px"" src=""https://gitee.com/heibaiying/BigData-Notes/raw/master/pictures/flume.png""></th>þ      <th><img width=""50px"" src=""https://gitee.com/heibaiying/BigData-Notes/raw/master/pictures/sqoop.png""></th>þ      <th><img width=""50px"" src=""https://gitee.com/heibaiying/BigData-Notes/raw/master/pictures/azkaban.png""></th>þ      <th><img width=""50px"" src=""https://gitee.com/heibaiying/BigData-Notes/raw/master/pictures/scala.jpg""></th>þ    </tr>þ    <tr>þ      <td align=""center""><a href=""#一hadoop"">Hadoop</a></td>þ      <td align=""center""><a href=""#二hive"">Hive</a></td>þ      <td align=""center""><a href=""#三spark"">Spark</a></td>þ      <td align=""center""><a href=""#四storm"">Storm</a></td>þ      <td align=""center""><a href=""#五flink"">Flink</a></td>þ      <td align=""center""><a href=""#六hbase"">HBase</a></td>þ      <td align=""center""><a href=""#七kafka"">Kafka</a></td>þ      <td align=""center""><a href=""#八zookeeper"">Zookeeper</a></td>þ      <td align=""center""><a href=""#九flume"">Flume</a></td>þ      <td align=""center""><a href=""#十sqoop"">Sqoop</a></td>þ      <td align=""center""><a href=""#十一azkaban"">Azkaban</a></td>þ      <td align=""center""><a href=""#十二scala"">Scala</a></td>þ    </tr>þ  </table>þ<br/>þþ<div align=""center"">þ <a href = ""https://github.com/heibaiying/Full-Stack-Notes""> þ <img width=""150px"" src=""https://gitee.com/heibaiying/BigData-Notes/raw/master/pictures/weixin.jpg""/> þ </a> þ</div>þ<div align=""center""> <strong> 如果需要离线阅读，可以在公众号上发送 “bigdata” 获取《大数据入门指南》离线阅读版！ </strong> </div>þþ<br/>þþ## :black_nib: 前  言þþ1. [大数据学习路线](notes/大数据学习路线.md)þ2. [大数据技术栈思维导图](notes/大数据技术栈思维导图.md)        þ3. [大数据常用软件安装指南](notes/大数据常用软件安装指南.md)þþ## 一、Hadoopþþ1. [分布式文件存储系统 —— HDFS](notes/Hadoop-HDFS.md)þ2. [分布式计算框架 —— MapReduce](notes/Hadoop-MapReduce.md)þ3. [集群资源管理器 —— YARN](notes/Hadoop-YARN.md)þ4. [Hadoop 单机伪集群环境搭建](notes/installation/Hadoop单机环境搭建.md)þ5. [Hadoop 集群环境搭建](notes/installation/Hadoop集群环境搭建.md)þ6. [HDFS 常用 Shell 命令](notes/HDFS常用Shell命令.md)þ7. [HDFS Java API 的使用](notes/HDFS-Java-API.md)þ8. [基于 Zookeeper 搭建 Hadoop 高可用集群](notes/installation/基于Zookeeper搭建Hadoop高可用集群.md)þþ## 二、Hiveþþ1. [Hive 简介及核心概念](notes/Hive简介及核心概念.md)þ2. [Linux 环境下 Hive 的安装部署](notes/installation/Linux环境下Hive的安装部署.md)þ4. [Hive CLI 和 Beeline 命令行的基本使用](notes/HiveCLI和Beeline命令行的基本使用.md)þ6. [Hive 常用 DDL 操作](notes/Hive常用DDL操作.md)þ7. [Hive 分区表和分桶表](notes/Hive分区表和分桶表.md)þ8. [Hive 视图和索引](notes/Hive视图和索引.md)þ9. [Hive 常用 DML 操作](notes/Hive常用DML操作.md)þ10. [Hive 数据查询详解](notes/Hive数据查询详解.md)þþ## 三、Sparkþþ**Spark Core :**þþ1. [Spark 简介](notes/Spark简介.md)þ2. [Spark 开发环境搭建](notes/installation/Spark开发环境搭建.md)þ4. [弹性式数据集 RDD](notes/Spark_RDD.md)þ5. [RDD 常用算子详解](notes/Spark_Transformation和Action算子.md)þ5. [Spark 运行模式与作业提交](notes/Spark部署模式与作业提交.md)þ6. [Spark 累加器与广播变量](notes/Spark累加器与广播变量.md)þ7. [基于 Zookeeper 搭建 Spark 高可用集群](notes/installation/Spark集群环境搭建.md)þþ**Spark SQL :**þþ1. [DateFrame 和 DataSet ](notes/SparkSQL_Dataset和DataFrame简介.md)þ2. [Structured API 的基本使用](notes/Spark_Structured_API的基本使用.md)þ3. [Spark SQL 外部数据源](notes/SparkSQL外部数据源.md)þ4. [Spark SQL 常用聚合函数](notes/SparkSQL常用聚合函数.md)þ5. [Spark SQL JOIN 操作](notes/SparkSQL联结操作.md)þþ**Spark Streaming ：**þþ1. [Spark Streaming 简介](notes/Spark_Streaming与流处理.md)þ2. [Spark Streaming 基本操作](notes/Spark_Streaming基本操作.md)þ3. [Spark Streaming 整合 Flume](notes/Spark_Streaming整合Flume.md)þ4. [Spark Streaming 整合 Kafka](notes/Spark_Streaming整合Kafka.md)þþ## 四、Stormþþ1. [Storm 和流处理简介](notes/Storm和流处理简介.md)þ2. [Storm 核心概念详解](notes/Storm核心概念详解.md)þ3. [Storm 单机环境搭建](notes/installation/Storm单机环境搭建.md)þ4. [Storm 集群环境搭建](notes/installation/Storm集群环境搭建.md)þ5. [Storm 编程模型详解](notes/Storm编程模型详解.md)þ6. [Storm 项目三种打包方式对比分析](notes/Storm三种打包方式对比分析.md)þ7. [Storm 集成 Redis 详解](notes/Storm集成Redis详解.md)þ8. [Storm 集成 HDFS/HBase](notes/Storm集成HBase和HDFS.md)þ9. [Storm 集成 Kafka](notes/Storm集成Kakfa.md)þþ## 五、Flinkþþ1. [Flink 核心概念综述](notes/Flink核心概念综述.md)þ2. [Flink 开发环境搭建](notes/Flink开发环境搭建.md)þ3. [Flink Data Source](notes/Flink_Data_Source.md)þ4. [Flink Data Transformation](notes/Flink_Data_Transformation.md)þ4. [Flink Data Sink](notes/Flink_Data_Sink.md)þ6. [Flink 窗口模型](notes/Flink_Windows.md)þ7. [Flink 状态管理与检查点机制](notes/Flink状态管理与检查点机制.md)þ8. [Flink Standalone 集群部署](notes/installation/Flink_Standalone_Cluster.md)þþþ## 六、HBaseþþ1. [Hbase 简介](notes/Hbase简介.md)þ2. [HBase 系统架构及数据结构](notes/Hbase系统架构及数据结构.md)þ3. [HBase 基本环境搭建 (Standalone /pseudo-distributed mode)](notes/installation/HBase单机环境搭建.md)þ4. [HBase 集群环境搭建](notes/installation/HBase集群环境搭建.md)þ5. [HBase 常用 Shell 命令](notes/Hbase_Shell.md)þ6. [HBase Java API](notes/Hbase_Java_API.md)þ7. [HBase 过滤器详解](notes/Hbase过滤器详解.md)þ8. [HBase 协处理器详解](notes/Hbase协处理器详解.md)þ9. [HBase 容灾与备份](notes/Hbase容灾与备份.md)þ10. [HBase的 SQL 中间层 —— Phoenix](notes/Hbase的SQL中间层_Phoenix.md)þ11. [Spring/Spring Boot 整合 Mybatis + Phoenix](notes/Spring+Mybtais+Phoenix整合.md)þþ## 七、Kafkaþþ1. [Kafka 简介](notes/Kafka简介.md)þ2. [基于 Zookeeper 搭建 Kafka 高可用集群](notes/installation/基于Zookeeper搭建Kafka高可用集群.md)þ3. [Kafka 生产者详解](notes/Kafka生产者详解.md)þ4. [Kafka 消费者详解](notes/Kafka消费者详解.md)þ5. [深入理解 Kafka 副本机制](notes/Kafka深入理解分区副本机制.md)þþ## 八、Zookeeperþþ1. [Zookeeper 简介及核心概念](notes/Zookeeper简介及核心概念.md)þ2. [Zookeeper 单机环境和集群环境搭建](notes/installation/Zookeeper单机环境和集群环境搭建.md) þ3. [Zookeeper 常用 Shell 命令](notes/Zookeeper常用Shell命令.md)þ4. [Zookeeper Java 客户端 —— Apache Curator](notes/Zookeeper_Java客户端Curator.md)þ5. [Zookeeper  ACL 权限控制](notes/Zookeeper_ACL权限控制.md)þþ## 九、Flumeþþ1. [Flume 简介及基本使用](notes/Flume简介及基本使用.md)þ2. [Linux 环境下 Flume 的安装部署](notes/installation/Linux下Flume的安装.md)þ3. [Flume 整合 Kafka](notes/Flume整合Kafka.md)þþ## 十、Sqoopþþ1. [Sqoop 简介与安装](notes/Sqoop简介与安装.md)þ2. [Sqoop 的基本使用](notes/Sqoop基本使用.md)þþ## 十一、Azkabanþþ1. [Azkaban 简介](notes/Azkaban简介.md)þ2. [Azkaban3.x 编译及部署](notes/installation/Azkaban_3.x_编译及部署.md)þ3. [Azkaban Flow 1.0 的使用](notes/Azkaban_Flow_1.0_的使用.md)þ4. [Azkaban Flow 2.0 的使用](notes/Azkaban_Flow_2.0_的使用.md)þþ## 十二、Scalaþþ1. [Scala 简介及开发环境配置](notes/Scala简介及开发环境配置.md)þ2. [基本数据类型和运算符](notes/Scala基本数据类型和运算符.md)þ3. [流程控制语句](notes/Scala流程控制语句.md)þ4. [数组 —— Array](notes/Scala数组.md)þ5. [集合类型综述](notes/Scala集合类型.md)þ6. [常用集合类型之 —— List & Set](notes/Scala列表和集.md)þ7. [常用集合类型之 —— Map & Tuple](notes/Scala映射和元组.md)þ8. [类和对象](notes/Scala类和对象.md)þ9. [继承和特质](notes/Scala继承和特质.md)þ10. [函数 & 闭包 & 柯里化](notes/Scala函数和闭包.md)þ11. [模式匹配](notes/Scala模式匹配.md)þ12. [类型参数](notes/Scala类型参数.md)þ13. [隐式转换和隐式参数](notes/Scala隐式转换和隐式参数.md)þþ## 十三、公共内容þþ1. [大数据应用常用打包方式](notes/大数据应用常用打包方式.md)þþ<br>þþ## :bookmark_tabs: 后  记þþ[资料分享与开发工具推荐](notes/资料分享与工具推荐.md)þþ<br>þþ<div align=""center"">þ <a href = ""https://blog.csdn.net/m0_37809146""> þ <img width=""200px"" src=""https://gitee.com/heibaiying/BigData-Notes/raw/master/pictures/blog-logo.png""/> þ </a> þ</div>þ<div align=""center""> <a  href = ""https://blog.csdn.net/m0_37809146""> 欢迎关注我的博客：https://blog.csdn.net/m0_37809146</a> </div>",
system-design-primer,,,,,,,,,,,,,,,,,,,,,,,,,,,,,,,,,,,,,,,,,,,,Not Found
